{
  "state_type": "PIPELINE_HEALTH",
  "schema_version": "1.0.0",
  "state_version": "1.0.0",
  "health": "GREEN",
  "pipeline_fingerprint": "2c45981e1970daff84e63b5b282578e1d3dff15b1ed52410ca04cfe191288a58",
  "validated_commit_sha": "88760cb136ab446cd8ab8533e86b9262afa2e8f3",
  "workflow_name": "pipeline-smoke",
  "workflow_run_id": 31312212318,
  "workflow_job_id": 93241624242,
  "validated_at": "2026-08-09T12:01:38Z",
  "required_stages": [
    "Fedora runtime and dependencies",
    "AWS provider-native Markdown acquisition",
    "service-guide constraint preservation",
    "factual/quota native Markdown acquisition",
    "HTML cleanup fallback",
    "PDF normalization fallback",
    "deterministic prompt bundling",
    "pipeline fingerprint generation",
    "artifact QA regression"
  ],
  "last_failure": {
    "status": "superseded_by_successful_validation",
    "note": "User reported the previous pipeline state/run as failed. Full replacement validation run 31312212318 passed all mandatory pipeline stages; artifact QA run 31312212353 also passed."
  },
  "next_permitted_action": "Pipeline-dependent demonstrations/control work are allowed only while this GREEN fingerprint matches current extraction-affecting files. Real study remains separately frozen."
}
